{
  "$schema": "../region.schema.json",
  "schemaVersion": 1,
  "id": "helenental",
  "label": "Helenental Phone Beta",
  "eyebrow": "Private regional prototype · three connected cards",
  "summary": "Start at Engelstein, take the owner-defined right-side journey to Jammerwandl, or take the left-side journey toward Siegenfelder Steinbruch. Each card opens the same five-module PWA structure.",
  "defaultNode": "engelstein",
  "notionUrl": "https://app.notion.com/p/3ab21413535181fe9132db7bc87bd1ac",
  "releaseState": "private-preview",
  "nodes": [
    {
      "id": "engelstein",
      "label": "Engelstein",
      "shortLabel": "Engelstein",
      "pilotId": "hel-engelstein",
      "role": "hero",
      "coordinate": { "latitude": 48.015914, "longitude": 16.196654, "source": "Vertical Moment canonical atlas", "confidence": "authoritative" },
      "relationship": "Owner-defined central point for this phone beta. Jammerwandl is the right-side branch; Steinbruch is the left-side branch.",
      "routeCount": 17,
      "media": {
        "state": "owner-reported",
        "availability": "owner-reported",
        "label": "Approved central Engelstein reveal",
        "poster": "/explore/pilots/hel-engelstein/media/engelstein-central-poster-720.jpg",
        "video": "/explore/pilots/hel-engelstein/media/engelstein-central-reveal-720.mp4",
        "duration": 43.5,
        "sourcePilot": "hel-engelstein",
        "note": "PRIVATE BETA — owner-approved DJI_0275 frames 14–100. The derivative and seekability are locally verified; rights, access, safety and public release remain separate gates."
      }
    },
    {
      "id": "jammerwandl",
      "label": "Jammerwandl",
      "shortLabel": "Jammerwandl",
      "pilotId": "hel-jammerwandl",
      "role": "core",
      "coordinate": { "latitude": 48.015336, "longitude": 16.198289, "source": "Vertical Moment canonical atlas", "confidence": "authoritative" },
      "relationship": "Right-side journey from Engelstein toward Jammerwandl, Vienna and the beginning of Helenental, then back toward Engelstein.",
      "routeCount": 37,
      "media": {
        "state": "owner-reported",
        "availability": "owner-reported",
        "label": "Approved Engelstein-to-Jammerwandl-and-back journey",
        "poster": "/explore/pilots/hel-jammerwandl/media/jammerwandl-journey-poster-720.jpg",
        "video": "/explore/pilots/hel-jammerwandl/media/engelstein-jammerwandl-return-720.mp4",
        "duration": 83.5,
        "sourcePilot": "hel-jammerwandl",
        "note": "PRIVATE BETA — DJI_0363 from 00:50 to end, followed by the complete DJI_0364 clip in reverse. The sequence is owner-approved; separate flight identity, rights and public release remain gated."
      }
    },
    {
      "id": "siegenfelder-steinbruch",
      "label": "Siegenfelder Steinbruch",
      "shortLabel": "Steinbruch",
      "pilotId": "hel-siegenfelder-steinbruch",
      "role": "spoke",
      "coordinate": { "latitude": 48.022607, "longitude": 16.192024, "source": "Vertical Moment canonical atlas", "confidence": "authoritative" },
      "relationship": "Left-side journey from Engelstein toward Badener Kletterschule and Siegenfelder Steinbruch; route and topo discrepancies remain visible review items.",
      "routeCount": 12,
      "media": {
        "state": "owner-reported",
        "availability": "owner-reported",
        "label": "Approved Engelstein-to-Steinbruch journey",
        "poster": "/explore/pilots/hel-siegenfelder-steinbruch/media/steinbruch-journey-poster-720.jpg",
        "video": "/explore/pilots/hel-siegenfelder-steinbruch/media/engelstein-steinbruch-720.mp4",
        "duration": 50.4,
        "sourcePilot": "hel-siegenfelder-steinbruch",
        "note": "PRIVATE BETA — DJI_0365 followed by DJI_0195 with the final seven seconds removed. DJI_0158 remains excluded; route identity, rights and public release remain gated."
      }
    }
  ]
}
